<?xml version="1.0" encoding="utf-8"?>
<?xml-stylesheet type="text/xsl" href="dados.xsl"?>
<projeto xmlns:xsi="http://www.w3.org/2001/XMLSchema-instance"
xsi:noNamespaceSchemaLocation="dados.xsd">
    <nome>LT 765kV</nome>
    <!--
      1 - PS
      2 - SVG
      3 - JPG
      4 - PNG
      5 - PDF
      6 - EPSLaTex
    -->
    <grafico>4</grafico>
      <vao>
        <ncfeixe>4</ncfeixe>
        <dfeixe>0.457</dfeixe>
        <gfeixe>
            <e>-14.34</e>
            <c>0.0</c>
            <d>14.34</d>
        </gfeixe>
        <comprimento>300.0</comprimento>
        <h0>25.0</h0>
        <eds>20.0</eds>
        <nl>30</nl>
        <tensao>765e3</tensao>
      </vao>
      <cabo>
        <modelo>BLUEJAY</modelo>
        <secao>603.09e-6</secao>
        <phi>31.96e-3</phi>
        <massa>1867.6e-3</massa>
        <trup>13526.0</trup>
        <alphafinal>20.9e-6</alphafinal>
        <elastfinal>6628.0e6</elastfinal>
        <pminimo>76</pminimo>
        <pmaximo>108</pmaximo>
        <tcop>75</tcop>
        <tamb>25</tamb>
        <tmax>39.2</tmax>
        <tmin>-0.3</tmin>
        <ventomed>20.0</ventomed>
      </cabo>
</projeto>
